{"type":"config","name":"nodejs-conformance-tests","metricName":"total_ms","metricUnit":"ms","bestDirection":"lower","timestamp":1774434798245}
{"commit":"","metric":622887,"metrics":{"tsc_ms":622887},"status":"keep","description":"Baseline: TSC variant on c5.4xlarge (16 vCPU, 32GB), 133 tests","timestamp":1774440179099,"segment":0,"confidence":null}
{"commit":"","metric":578662,"metrics":{"tsc_ms":578662},"status":"keep","description":"Experiment 1: Cache pulumi-test-language binary build across variants + OTel tracing instrumentation","timestamp":1774442719685,"segment":0,"confidence":null}
{"commit":"","metric":745943,"metrics":{"tsc_ms":745943},"status":"discard","description":"Experiment 2: Reduced parallelism to -parallel=4 (SLOWER - 27% regression)","timestamp":1774444217293,"segment":0,"confidence":null}
{"commit":"","metric":589055,"metrics":{"tsc_ms":589055},"status":"discard","description":"Experiment 3: Increased parallelism to -parallel=16 (no improvement over default)","timestamp":1774444859904,"segment":0,"confidence":null}
{"commit":"","metric":0,"metrics":{"tsc_ms":0},"status":"crash","description":"Experiment 4: npm_config_prefer_offline=true - instance became unresponsive, likely caused issues with local tarball installs","timestamp":1774450256647,"segment":0,"confidence":null}
{"commit":"","metric":698131,"metrics":{"tsc_ms":698131},"status":"discard","description":"Experiment 5: node_modules + tsc output caching via hardlinks (SLOWER - cache overhead > savings)","timestamp":1774470198505,"segment":0,"confidence":null}
{"commit":"","metric":319259,"metrics":{"tsc_ms":319259},"status":"keep","description":"Experiment 6: tmpfs (RAM disk) for test temp directories - 44.8% improvement","timestamp":1774470613526,"segment":0,"confidence":null}
{"commit":"","metric":721088,"metrics":{"tsc_ms":721088},"status":"discard","description":"Experiment 7: tmpfs + parallel=32 (SLOWER - too much parallelism on tmpfs causes OOM/swapping)","timestamp":1774472050915,"segment":0,"confidence":null}
{"commit":"","metric":607393,"metrics":{"total_ms":607393},"status":"keep","description":"Experiment 8: All 3 variants (TSC+TSNode+Bun) in parallel with tmpfs — 607s total vs 578s for TSC alone baseline","timestamp":1774474006460,"segment":0,"confidence":null}
{"commit":"","metric":268454,"metrics":{"tsc_ms":268454},"status":"keep","description":"Experiment 9: Skip local=true early + npm --no-audit --no-fund — 268s (53.6% improvement from baseline)","timestamp":1774515424190,"segment":0,"confidence":null}
{"commit":"05ab3a83ca","metric":551916,"metrics":{"total_ms":551916,"tsc_ms":268454},"status":"keep","description":"Experiment 10: All 3 variants with skip local early + npm --no-audit --no-fund + tmpfs — 551s total","timestamp":1774516218490,"segment":0,"confidence":null}
{"commit":"","metric":227106,"metrics":{"tsc_ms":227106},"status":"keep","description":"Experiment 11: Skip installDependencies for subsequent shared-source runs — 227s (60.8% from baseline)","timestamp":1774516582248,"segment":0,"confidence":null}
{"commit":"9136cd59e5","metric":531318,"metrics":{"total_ms":531318,"tsc_ms":227106},"status":"keep","description":"Experiment 12: All 3 variants with all optimizations — 531s total (64% improvement from estimated sequential baseline)","timestamp":1774517338063,"segment":0,"confidence":null}
{"commit":"","metric":263395,"metrics":{"tsc_ms":263395},"status":"keep","description":"Experiment 13: Policy pack install caching — 263s (possible noise, marginal change)","timestamp":1774518915843,"segment":0,"confidence":null}
{"commit":"","metric":192080,"metrics":{"tsc_ms":192080},"status":"keep","description":"Experiment 14: tsc --skipLibCheck — 192s (66.8% improvement from baseline 578s)","timestamp":1774519233739,"segment":0,"confidence":null}
{"commit":"d5a7ab11fc","metric":520745,"metrics":{"total_ms":520745,"tsc_ms":192080},"status":"keep","description":"Experiment 15: All 3 variants with all optimizations including --skipLibCheck — 520s total","timestamp":1774519966643,"segment":0,"confidence":null}
{"commit":"","metric":180898,"metrics":{"tsc_ms":180898},"status":"keep","description":"Experiment 16: npm --no-optional — 181s (68.7% from baseline)","timestamp":1774520440587,"segment":0,"confidence":null}
{"commit":"","metric":184288,"metrics":{"tsc_ms":184288},"status":"discard","description":"Experiment 17: --ignore-scripts — no improvement (184s vs 181s, within noise)","timestamp":1774520671756,"segment":0,"confidence":null}
{"commit":"","metric":179838,"metrics":{"tsc_ms":179838},"status":"discard","description":"Experiment 18: --install-strategy=shallow — marginal (179s vs 181s)","timestamp":1774520905703,"segment":0,"confidence":null}
{"commit":"b4d4d63adc","metric":505403,"metrics":{"total_ms":505403,"tsc_ms":180898},"status":"keep","description":"Experiment 19: Final 3-variant benchmark — 505s total (66% from baseline)","timestamp":1774521666760,"segment":0,"confidence":null}
{"commit":"","metric":175541,"metrics":{"tsc_ms":175541},"status":"keep","description":"Experiment 20: Shared PackageCache for PCL binding + npm flags in Pack — 175s (69.7% from baseline)","timestamp":1774522122321,"segment":0,"confidence":null}
{"commit":"","metric":139809,"metrics":{"tsc_ms":139809},"status":"keep","description":"Experiment 21: --skipLibCheck in SDK Pack build — 139s (75.8% from baseline 578s)","timestamp":1774522430956,"segment":0,"confidence":null}
{"commit":"586670b270","metric":336526,"metrics":{"total_ms":336526,"tsc_ms":139809},"status":"keep","description":"Experiment 22: All 3 variants — 336s (77.2% from sequential baseline)","timestamp":1774522946307,"segment":0,"confidence":null}
{"commit":"","metric":192980,"metrics":{"tsc_ms":192980},"status":"discard","description":"Experiment 23: --prefer-offline — 193s (regression from 139s, reverted)","timestamp":1774523525295,"segment":0,"confidence":null}
{"commit":"","metric":181779,"metrics":{"tsc_ms":181779},"status":"keep","description":"Experiment 24: --install-strategy=shallow — 182s (confirmed ~5% over without)","timestamp":1774523962932,"segment":0,"confidence":null}
{"commit":"0347293ed9","metric":436187,"metrics":{"total_ms":436187,"tsc_ms":181779},"status":"keep","description":"Experiment 25: Confirmed clean 3-variant — 436s (70.5% from sequential baseline)","timestamp":1774524474399,"segment":0,"confidence":null}
{"commit":"","metric":154656,"metrics":{"tsc_ms":154656},"status":"keep","description":"Experiment 26: Pre-warm npm cache — 154s (73.2% from baseline)","timestamp":1774524709629,"segment":0,"confidence":null}
{"commit":"daa46f7574","metric":329367,"metrics":{"total_ms":329367,"tsc_ms":154656},"status":"keep","description":"Experiment 27: All 3 variants with cache warming — 329s (77.7% from baseline)","timestamp":1774525219710,"segment":0,"confidence":null}
{"commit":"","metric":175713,"metrics":{"tsc_ms":175713},"status":"keep","description":"Experiment 28: --skipLibCheck in core SDK Pack — 175s (marginal, core pack only runs once)","timestamp":1774525761027,"segment":0,"confidence":null}
{"commit":"cf0f31388a","metric":536378,"metrics":{"total_ms":536378},"status":"keep","description":"Experiment 29: All 3 variants cold cache — 536s (variance from 329s warm)","timestamp":1774532217600,"segment":0,"confidence":null}
{"commit":"","metric":192565,"metrics":{"tsc_ms":192565},"status":"keep","description":"Experiment 30: Improved cache warming (add typescript + @types/node) — 192s cold","timestamp":1774532492533,"segment":0,"confidence":null}
{"commit":"","metric":134748,"metrics":{"tsc_ms":134748},"status":"keep","description":"Experiment 31: --legacy-peer-deps — 134s (76.7% from baseline)","timestamp":1774532699973,"segment":0,"confidence":null}
{"commit":"78bdf5770e","metric":458694,"metrics":{"total_ms":458694,"tsc_ms":134748},"status":"keep","description":"Experiment 32: All 3 variants with --legacy-peer-deps — 458s warm cache","timestamp":1774534628077,"segment":0,"confidence":null}
{"commit":"","metric":190649,"metrics":{"tsc_ms":190649},"status":"discard","description":"Experiment 33: npm cache on tmpfs — 190s (cold tmpfs cache worse than warm disk cache)","timestamp":1774534846194,"segment":0,"confidence":null}
{"commit":"0b97d9425a","metric":183000,"metrics":{"tsc_ms_run1":183325,"tsc_ms_run2":172212,"tsc_ms_run3":191771,"tsc_ms_median":183325},"status":"keep","description":"Experiment 34: TSC 3-run variance — 183s median (172-191s range), 68.3% from baseline","timestamp":1774535486323,"segment":0,"confidence":null}
{"commit":"","metric":192089,"metrics":{"tsc_ms":192089},"status":"discard","description":"Experiment 35: Pre-seed node_modules via cp -a — 192s (no improvement, npm re-resolves anyway)","timestamp":1774535991780,"segment":0,"confidence":null}
{"commit":"","metric":215586,"metrics":{"tsc_ms":215586},"status":"keep","description":"Experiment 36: Pack npm flags (--install-strategy=shallow --legacy-peer-deps) — 215s (high variance from l1-builtin-require-pulumi-version)","timestamp":1774536940009,"segment":0,"confidence":null}
{"commit":"7326d961f2","metric":199239,"metrics":{"tsc_ms":199239},"status":"keep","description":"Experiment 37: TSC after removing shared PackageCache fix — 199s (65.6% from baseline, correctness fixed)","timestamp":1774538167949,"segment":0,"confidence":null}
{"commit":"","metric":212124,"metrics":{"tsc_ms":212124},"status":"keep","description":"Experiment 38: Per-test PackageCache (safe, correctness preserved) — 212s","timestamp":1774538601170,"segment":0,"confidence":null}
{"commit":"62e310961b","metric":192696,"metrics":{"tsc_ms_run1":183888,"tsc_ms_run2":201504,"tsc_ms_avg":192696},"status":"keep","description":"Experiment 39: Back-to-back TSC runs — 184s/201s (avg 192s, 66.7% from baseline)","timestamp":1774539462693,"segment":0,"confidence":null}
{"commit":"","metric":159840,"metrics":{"tsc_ms":159840},"status":"keep","description":"Experiment 40: GOMAXPROCS=32 parallel=32 — 159s (72.4% from baseline)","timestamp":1774539863207,"segment":0,"confidence":null}
{"commit":"","metric":0,"metrics":{},"status":"crash","description":"Experiment 41: GOMAXPROCS=64 parallel=64 — instance OOM, too much memory pressure","timestamp":1774541163003,"segment":0,"confidence":null}
{"commit":"3467cc8ddb","metric":166952,"metrics":{"tsc_ms_warm":166952,"tsc_ms_cold":209428,"total_3var_cold":563705},"status":"keep","description":"Experiment 42: Final confirmed — TSC 167s warm / 209s cold, all 3: 563s cold. GOMAXPROCS=32","timestamp":1774543461713,"segment":0,"confidence":null}
{"commit":"af81ff6d78","metric":502140,"metrics":{"total_ms":502140},"status":"keep","description":"Experiment 43: Final all-3-variant warm GOMAXPROCS=32 — 502s (66% from ~1478s baseline)","timestamp":1774544561097,"segment":0,"confidence":null}
{"commit":"","metric":215478,"metrics":{"tsc_ms":215478},"status":"discard","description":"Experiment 44: DISABLE_AUTOMATIC_PLUGIN_ACQUISITION — 215s (WORSE, causes plugin errors)","timestamp":1774544969996,"segment":0,"confidence":null}
{"commit":"de8a655d06","metric":177027,"metrics":{"tsc_ms_run1":169242,"tsc_ms_run2":184812,"tsc_ms_avg":177027},"status":"keep","description":"Experiment 45: Stable measurement — 169s/185s avg 177s (69.4% from baseline)","timestamp":1774545491426,"segment":0,"confidence":null}
{"commit":"","metric":208391,"metrics":{"tsc_ms":208391},"status":"keep","description":"Experiment 46: Final stable measurement — 208s (64% from baseline)","timestamp":1774546403188,"segment":0,"confidence":null}
{"commit":"","metric":144178,"metrics":{"tsc_ms_run1":150341,"tsc_ms_run2":138014,"tsc_ms_run3":302393,"tsc_ms_avg_excl_outlier":144178},"status":"keep","description":"Experiment 47: PULUMI_SKIP_CHECKPOINTS=true — 150s/138s/302s(outlier), avg 144s excl outlier (75.1% from baseline)","timestamp":1774600692662,"segment":0,"confidence":null}
{"commit":"da1e0ba90c","metric":329608,"metrics":{"total_ms":329608},"status":"keep","description":"Experiment 48: All 3 variants with SKIP_CHECKPOINTS + TRANSPILE_ONLY — 329s (77.7% from baseline)","timestamp":1774601519203,"segment":0,"confidence":null}
{"commit":"","metric":169602,"metrics":{"tsc_ms":169602},"status":"discard","description":"Experiment 49-51: NODE_OPTIONS, Go -gcflags, DISABLE_JOURNALING — no meaningful improvement beyond SKIP_CHECKPOINTS","timestamp":1774602341470,"segment":0,"confidence":null}
{"commit":"","metric":140257,"metrics":{"tsc_ms":140257},"status":"keep","description":"Experiment 52: Inline snapshot edits (avoid temp dir copy) — 140s","timestamp":1774602779756,"segment":0,"confidence":null}
{"commit":"","metric":137738,"metrics":{"tsc_ms_run1":122801,"tsc_ms_run2":152674,"tsc_ms_avg":137738},"status":"keep","description":"Experiment 53: All inline snapshot edits — 122s/152s avg 137s (76.2% from baseline)","timestamp":1774603498387,"segment":0,"confidence":null}
{"commit":"959f304522","metric":351141,"metrics":{"total_ms":351141,"tsc_ms_avg":137738},"status":"keep","description":"Experiment 53 FINAL: All 3 variants 351s, TSC avg 137s — 76% from baseline","timestamp":1774603982823,"segment":0,"confidence":null}
